{
  "type": "PLUGIN",
  "schemaVersion": 1,
  "name": "kotlin-tdd-development",
  "version": "0.1.0",
  "description": "Kotlin TDD, strict type and schema boundaries, Gradle green checks, and PR lifecycle workflows composed from independent primitives.",
  "skills": [
    {
      "type": "SKILL",
      "source": {
        "type": "LOCAL_SOURCE",
        "path": "./"
      },
      "path": "skills/tdd",
      "name": "tdd"
    },
    {
      "type": "SKILL",
      "source": {
        "type": "LOCAL_SOURCE",
        "path": "./"
      },
      "path": "skills/kotlin-standards",
      "name": "kotlin-standards"
    },
    {
      "type": "SKILL",
      "source": {
        "type": "LOCAL_SOURCE",
        "path": "./"
      },
      "path": "skills/kotlin-gradle-validation",
      "name": "kotlin-gradle-validation"
    },
    {
      "type": "SKILL",
      "source": {
        "type": "LOCAL_SOURCE",
        "path": "./"
      },
      "path": "skills/manage-json-schemas",
      "name": "manage-json-schemas"
    },
    {
      "type": "SKILL",
      "source": {
        "type": "LOCAL_SOURCE",
        "path": "./"
      },
      "path": "skills/git-change-flow",
      "name": "git-change-flow"
    },
    {
      "type": "SKILL",
      "source": {
        "type": "LOCAL_SOURCE",
        "path": "./"
      },
      "path": "skills/github-ci-operations",
      "name": "github-ci-operations"
    },
    {
      "type": "SKILL",
      "source": {
        "type": "LOCAL_SOURCE",
        "path": "./"
      },
      "path": "skills/pull-request-lifecycle",
      "name": "pull-request-lifecycle"
    }
  ],
  "agents": [
    {
      "type": "AGENT",
      "source": {
        "type": "LOCAL_SOURCE",
        "path": "./"
      },
      "path": "agents/kotlin-review/kotlin-review-captain.agent.md",
      "name": "kotlin-review-captain"
    },
    {
      "type": "AGENT",
      "source": {
        "type": "LOCAL_SOURCE",
        "path": "./"
      },
      "path": "agents/kotlin-review/kotlin-type-safety-reviewer.agent.md",
      "name": "kotlin-type-safety-reviewer"
    },
    {
      "type": "AGENT",
      "source": {
        "type": "LOCAL_SOURCE",
        "path": "./"
      },
      "path": "agents/kotlin-review/kotlin-boundary-contract-reviewer.agent.md",
      "name": "kotlin-boundary-contract-reviewer"
    },
    {
      "type": "AGENT",
      "source": {
        "type": "LOCAL_SOURCE",
        "path": "./"
      },
      "path": "agents/kotlin-review/kotlin-package-cohesion-reviewer.agent.md",
      "name": "kotlin-package-cohesion-reviewer"
    },
    {
      "type": "AGENT",
      "source": {
        "type": "LOCAL_SOURCE",
        "path": "./"
      },
      "path": "agents/schema-type-enforcer.agent.md",
      "name": "schema-type-enforcer"
    }
  ],
  "instructions": [
    {
      "type": "INSTRUCTION",
      "source": {
        "type": "LOCAL_SOURCE",
        "path": "./"
      },
      "path": "concepts/type-safety/core.md",
      "name": "type-safety"
    },
    {
      "type": "INSTRUCTION",
      "source": {
        "type": "LOCAL_SOURCE",
        "path": "./"
      },
      "path": "concepts/schema-driven-design/core.md",
      "name": "schema-driven-design"
    }
  ],
  "hooks": [
    {
      "type": "HOOK",
      "source": {
        "type": "LOCAL_SOURCE",
        "path": "./"
      },
      "path": "hooks/kotlin-horizontalization-check.hook.json",
      "name": "kotlin-horizontalization-check"
    },
    {
      "type": "HOOK",
      "source": {
        "type": "LOCAL_SOURCE",
        "path": "./"
      },
      "path": "hooks/gradle-check-green.hook.json",
      "name": "gradle-check-green"
    }
  ],
  "metadata": {
    "composition": "referential",
    "sourceFamily": "developer-workflow"
  }
}
