{
  "type": "PLUGIN",
  "schemaVersion": 1,
  "name": "intelligence-core",
  "version": "0.1.0",
  "description": "Core portable instructions and hooks from the intelligence source graph.",
  "skills": [],
  "agents": [],
  "instructions": [
    {
      "type": "INSTRUCTION",
      "source": {
        "type": "LOCAL_SOURCE",
        "path": "./"
      },
      "path": "plugouts/concepts/type-safety/core.md",
      "name": "type-safety"
    },
    {
      "type": "INSTRUCTION",
      "source": {
        "type": "LOCAL_SOURCE",
        "path": "./"
      },
      "path": "plugouts/concepts/schema-driven-design/core.md",
      "name": "schema-driven-design"
    }
  ],
  "hooks": [
    {
      "type": "HOOK",
      "source": {
        "type": "LOCAL_SOURCE",
        "path": "./"
      },
      "path": "hooks/agents-md-turn-refresh.hook.json",
      "name": "agents-md-turn-refresh"
    }
  ],
  "metadata": {
    "composition": "referential"
  }
}
