{
  "type": "PLUGIN",
  "schemaVersion": 1,
  "name": "kotlin-agentic-correctness",
  "version": "0.1.0",
  "description": "Single Kotlin workflow combining typed design discipline, invariant-oriented Kotlin standards, filesystem-backed evidence, Kast semantic tooling, and Gradle/PR proof loops.",
  "skills": [
    {
      "type": "SKILL",
      "source": {
        "type": "LOCAL_SOURCE",
        "path": "./"
      },
      "path": "skills/kotlin-agentic-correctness",
      "name": "kotlin-agentic-correctness"
    },
    {
      "type": "SKILL",
      "source": {
        "type": "LOCAL_SOURCE",
        "path": "./"
      },
      "path": "skills/kotlin-review",
      "name": "kotlin-review",
      "dependsOn": [
        {
          "type": "SKILL",
          "source": {
            "type": "LOCAL_SOURCE",
            "path": "./"
          },
          "path": "skills/kotlin-standards",
          "name": "kotlin-standards"
        },
        {
          "type": "SKILL",
          "source": {
            "type": "LOCAL_SOURCE",
            "path": "./"
          },
          "path": "skills/kotlin-gradle-validation",
          "name": "kotlin-gradle-validation"
        },
        {
          "type": "AGENT",
          "source": {
            "type": "LOCAL_SOURCE",
            "path": "./"
          },
          "path": "agents/kotlin-review/kotlin-review-captain.agent.md",
          "name": "kotlin-review-captain"
        },
        {
          "type": "AGENT",
          "source": {
            "type": "LOCAL_SOURCE",
            "path": "./"
          },
          "path": "agents/kotlin-review/kotlin-type-safety-reviewer.agent.md",
          "name": "kotlin-type-safety-reviewer"
        },
        {
          "type": "AGENT",
          "source": {
            "type": "LOCAL_SOURCE",
            "path": "./"
          },
          "path": "agents/kotlin-review/kotlin-boundary-contract-reviewer.agent.md",
          "name": "kotlin-boundary-contract-reviewer"
        },
        {
          "type": "AGENT",
          "source": {
            "type": "LOCAL_SOURCE",
            "path": "./"
          },
          "path": "agents/kotlin-review/kotlin-package-cohesion-reviewer.agent.md",
          "name": "kotlin-package-cohesion-reviewer"
        },
        {
          "type": "INSTRUCTION",
          "source": {
            "type": "LOCAL_SOURCE",
            "path": "./"
          },
          "path": "concepts/type-safety/core.md",
          "name": "type-safety"
        },
        {
          "type": "INSTRUCTION",
          "source": {
            "type": "LOCAL_SOURCE",
            "path": "./"
          },
          "path": "concepts/schema-driven-design/core.md",
          "name": "schema-driven-design"
        }
      ]
    },
    {
      "type": "SKILL",
      "source": {
        "type": "LOCAL_SOURCE",
        "path": "./"
      },
      "path": "skills/kotlin-standards",
      "name": "kotlin-standards"
    },
    {
      "type": "SKILL",
      "source": {
        "type": "LOCAL_SOURCE",
        "path": "./"
      },
      "path": "skills/kotlin-gradle-validation",
      "name": "kotlin-gradle-validation"
    },
    {
      "type": "SKILL",
      "source": {
        "type": "LOCAL_SOURCE",
        "path": "./"
      },
      "path": "skills/tdd",
      "name": "tdd"
    },
    {
      "type": "SKILL",
      "source": {
        "type": "LOCAL_SOURCE",
        "path": "./"
      },
      "path": "skills/define-goal",
      "name": "define-goal"
    },
    {
      "type": "SKILL",
      "source": {
        "type": "LOCAL_SOURCE",
        "path": "./"
      },
      "path": "skills/git-change-flow",
      "name": "git-change-flow"
    },
    {
      "type": "SKILL",
      "source": {
        "type": "LOCAL_SOURCE",
        "path": "./"
      },
      "path": "skills/github-ci-operations",
      "name": "github-ci-operations"
    },
    {
      "type": "SKILL",
      "source": {
        "type": "LOCAL_SOURCE",
        "path": "./"
      },
      "path": "skills/pull-request-lifecycle",
      "name": "pull-request-lifecycle"
    },
    {
      "type": "SKILL",
      "source": {
        "type": "LOCAL_SOURCE",
        "path": "./"
      },
      "path": "skills/shell-script-safety",
      "name": "shell-script-safety"
    }
  ],
  "agents": [
    {
      "type": "AGENT",
      "source": {
        "type": "LOCAL_SOURCE",
        "path": "./"
      },
      "path": "agents/kotlin-review/kotlin-review-captain.agent.md",
      "name": "kotlin-review-captain"
    },
    {
      "type": "AGENT",
      "source": {
        "type": "LOCAL_SOURCE",
        "path": "./"
      },
      "path": "agents/kotlin-review/kotlin-type-safety-reviewer.agent.md",
      "name": "kotlin-type-safety-reviewer"
    },
    {
      "type": "AGENT",
      "source": {
        "type": "LOCAL_SOURCE",
        "path": "./"
      },
      "path": "agents/kotlin-review/kotlin-boundary-contract-reviewer.agent.md",
      "name": "kotlin-boundary-contract-reviewer"
    },
    {
      "type": "AGENT",
      "source": {
        "type": "LOCAL_SOURCE",
        "path": "./"
      },
      "path": "agents/kotlin-review/kotlin-package-cohesion-reviewer.agent.md",
      "name": "kotlin-package-cohesion-reviewer"
    },
    {
      "type": "AGENT",
      "source": {
        "type": "LOCAL_SOURCE",
        "path": "./"
      },
      "path": "agents/schema-type-enforcer.agent.md",
      "name": "schema-type-enforcer"
    }
  ],
  "instructions": [
    {
      "type": "INSTRUCTION",
      "source": {
        "type": "LOCAL_SOURCE",
        "path": "./"
      },
      "path": "concepts/type-safety/core.md",
      "name": "type-safety"
    },
    {
      "type": "INSTRUCTION",
      "source": {
        "type": "LOCAL_SOURCE",
        "path": "./"
      },
      "path": "concepts/schema-driven-design/core.md",
      "name": "schema-driven-design"
    }
  ],
  "hooks": [
    {
      "type": "HOOK",
      "source": {
        "type": "LOCAL_SOURCE",
        "path": "./"
      },
      "path": "hooks/agents-md-turn-refresh.hook.json",
      "name": "agents-md-turn-refresh"
    },
    {
      "type": "HOOK",
      "source": {
        "type": "LOCAL_SOURCE",
        "path": "./"
      },
      "path": "hooks/required-skill-read.hook.json",
      "name": "required-skill-read"
    },
    {
      "type": "HOOK",
      "source": {
        "type": "LOCAL_SOURCE",
        "path": "./"
      },
      "path": "hooks/kotlin-horizontalization-check.hook.json",
      "name": "kotlin-horizontalization-check"
    },
    {
      "type": "HOOK",
      "source": {
        "type": "LOCAL_SOURCE",
        "path": "./"
      },
      "path": "hooks/gradle-check-green.hook.json",
      "name": "gradle-check-green"
    }
  ],
  "metadata": {
    "composition": "curated-synthesis",
    "informationExchange": "filesystem-first",
    "kast": "prefer-packaged-kast-skill-or-request-file-rpc",
    "principle": "typed-kotlin-workflow-with-file-backed-evidence"
  }
}
