{
  "type": "PLUGIN",
  "schemaVersion": 1,
  "name": "evidence-driven-delivery",
  "version": "0.1.0",
  "description": "Goal definition, test-driven implementation, Git hygiene, CI triage, and PR lifecycle procedures with explicit proof.",
  "skills": [
    {
      "type": "SKILL",
      "source": {
        "type": "LOCAL_SOURCE",
        "path": "./"
      },
      "path": "skills/define-goal",
      "name": "define-goal"
    },
    {
      "type": "SKILL",
      "source": {
        "type": "LOCAL_SOURCE",
        "path": "./"
      },
      "path": "skills/tdd",
      "name": "tdd"
    },
    {
      "type": "SKILL",
      "source": {
        "type": "LOCAL_SOURCE",
        "path": "./"
      },
      "path": "skills/git-change-flow",
      "name": "git-change-flow"
    },
    {
      "type": "SKILL",
      "source": {
        "type": "LOCAL_SOURCE",
        "path": "./"
      },
      "path": "skills/github-ci-operations",
      "name": "github-ci-operations"
    },
    {
      "type": "SKILL",
      "source": {
        "type": "LOCAL_SOURCE",
        "path": "./"
      },
      "path": "skills/pull-request-lifecycle",
      "name": "pull-request-lifecycle"
    }
  ],
  "agents": [],
  "instructions": [
    {
      "type": "INSTRUCTION",
      "source": {
        "type": "LOCAL_SOURCE",
        "path": "./"
      },
      "path": "concepts/type-safety/core.md",
      "name": "type-safety"
    },
    {
      "type": "INSTRUCTION",
      "source": {
        "type": "LOCAL_SOURCE",
        "path": "./"
      },
      "path": "concepts/schema-driven-design/core.md",
      "name": "schema-driven-design"
    }
  ],
  "hooks": [],
  "metadata": {
    "composition": "referential",
    "principle": "claims-require-executable-evidence"
  }
}
