{
  "type": "PLUGIN",
  "schemaVersion": 1,
  "name": "agent-platform-authoring",
  "version": "0.1.0",
  "description": "Agent platform authoring kit for maintaining the source graph: skills, agents, hooks, schemas, plugin manifests, repo maps, and docs surfaces.",
  "skills": [
    {
      "type": "SKILL",
      "source": {
        "type": "LOCAL_SOURCE",
        "path": "./"
      },
      "path": "skills/skill-primitive-authoring",
      "name": "skill-primitive-authoring"
    },
    {
      "type": "SKILL",
      "source": {
        "type": "LOCAL_SOURCE",
        "path": "./"
      },
      "path": "skills/agent-profile-authoring",
      "name": "agent-profile-authoring"
    },
    {
      "type": "SKILL",
      "source": {
        "type": "LOCAL_SOURCE",
        "path": "./"
      },
      "path": "skills/plugin-composition-authoring",
      "name": "plugin-composition-authoring"
    },
    {
      "type": "SKILL",
      "source": {
        "type": "LOCAL_SOURCE",
        "path": "./"
      },
      "path": "skills/hook-primitive-authoring",
      "name": "hook-primitive-authoring"
    },
    {
      "type": "SKILL",
      "source": {
        "type": "LOCAL_SOURCE",
        "path": "./"
      },
      "path": "skills/shell-script-safety",
      "name": "shell-script-safety"
    },
    {
      "type": "SKILL",
      "source": {
        "type": "LOCAL_SOURCE",
        "path": "./"
      },
      "path": "skills/manage-json-schemas",
      "name": "manage-json-schemas"
    },
    {
      "type": "SKILL",
      "source": {
        "type": "LOCAL_SOURCE",
        "path": "./"
      },
      "path": "skills/repo-instruction-topology",
      "name": "repo-instruction-topology"
    },
    {
      "type": "SKILL",
      "source": {
        "type": "LOCAL_SOURCE",
        "path": "./"
      },
      "path": "skills/repository-signature-indexing",
      "name": "repository-signature-indexing"
    },
    {
      "type": "SKILL",
      "source": {
        "type": "LOCAL_SOURCE",
        "path": "./"
      },
      "path": "skills/local-repository-navigation",
      "name": "local-repository-navigation"
    },
    {
      "type": "SKILL",
      "source": {
        "type": "LOCAL_SOURCE",
        "path": "./"
      },
      "path": "skills/reference-doc-workflow",
      "name": "reference-doc-workflow"
    },
    {
      "type": "SKILL",
      "source": {
        "type": "LOCAL_SOURCE",
        "path": "./"
      },
      "path": "skills/site-docs-authoring",
      "name": "site-docs-authoring"
    }
  ],
  "agents": [],
  "instructions": [
    {
      "type": "INSTRUCTION",
      "source": {
        "type": "LOCAL_SOURCE",
        "path": "./"
      },
      "path": "concepts/type-safety/core.md",
      "name": "type-safety"
    },
    {
      "type": "INSTRUCTION",
      "source": {
        "type": "LOCAL_SOURCE",
        "path": "./"
      },
      "path": "concepts/schema-driven-design/core.md",
      "name": "schema-driven-design"
    }
  ],
  "hooks": [],
  "metadata": {
    "composition": "referential",
    "dailyDriver": "Use for maintaining the canonical source graph and APM marketplace packaging.",
    "notFor": "Product-code delivery, Kotlin implementation loops, or runtime activation plans until consolidation and linking primitives are hardened.",
    "owner": "intelligence-source-graph-platform",
    "principle": "primitives-remain-independent",
    "role": "agent-platform-authoring",
    "scope": "Author and validate independent skills, agents, hooks, plugin manifests, repository instructions, signature indexes, navigation maps, and docs-site guidance."
  }
}
