{
  "type": "PLUGIN",
  "schemaVersion": 1,
  "name": "repository-orientation",
  "version": "0.1.0",
  "description": "Repository boundary mapping, scoped instruction authoring, and signature indexing composed from independent skills.",
  "skills": [
    {
      "type": "SKILL",
      "source": {
        "type": "LOCAL_SOURCE",
        "path": "./"
      },
      "path": "skills/repo-instruction-topology",
      "name": "repo-instruction-topology"
    },
    {
      "type": "SKILL",
      "source": {
        "type": "LOCAL_SOURCE",
        "path": "./"
      },
      "path": "skills/repository-signature-indexing",
      "name": "repository-signature-indexing"
    },
    {
      "type": "SKILL",
      "source": {
        "type": "LOCAL_SOURCE",
        "path": "./"
      },
      "path": "skills/local-repository-navigation",
      "name": "local-repository-navigation"
    },
    {
      "type": "SKILL",
      "source": {
        "type": "LOCAL_SOURCE",
        "path": "./"
      },
      "path": "skills/reference-doc-workflow",
      "name": "reference-doc-workflow"
    }
  ],
  "agents": [],
  "instructions": [],
  "hooks": [],
  "metadata": {
    "composition": "referential",
    "promotionManifest": "garden/manifests/promotions.json"
  }
}
