{
  "type": "PLUGIN",
  "schemaVersion": 1,
  "name": "typed-design-discipline",
  "version": "0.1.0",
  "description": "Core type-safety, schema-driven design, onboarding, and turn-time hooks for rigorous repository work.",
  "skills": [
    {
      "type": "SKILL",
      "source": {
        "type": "LOCAL_SOURCE",
        "path": "./"
      },
      "path": "skills/repository-onboarding",
      "name": "repository-onboarding"
    }
  ],
  "agents": [],
  "instructions": [
    {
      "type": "INSTRUCTION",
      "source": {
        "type": "LOCAL_SOURCE",
        "path": "./"
      },
      "path": "concepts/type-safety/core.md",
      "name": "type-safety"
    },
    {
      "type": "INSTRUCTION",
      "source": {
        "type": "LOCAL_SOURCE",
        "path": "./"
      },
      "path": "concepts/schema-driven-design/core.md",
      "name": "schema-driven-design"
    }
  ],
  "hooks": [
    {
      "type": "HOOK",
      "source": {
        "type": "LOCAL_SOURCE",
        "path": "./"
      },
      "path": "hooks/agents-md-turn-refresh.hook.json",
      "name": "agents-md-turn-refresh"
    },
    {
      "type": "HOOK",
      "source": {
        "type": "LOCAL_SOURCE",
        "path": "./"
      },
      "path": "hooks/required-skill-read.hook.json",
      "name": "required-skill-read"
    }
  ],
  "metadata": {
    "composition": "referential",
    "principle": "make-illegal-states-unrepresentable"
  }
}
