{
  "type": "PLUGIN",
  "schemaVersion": 1,
  "name": "primitive-governance",
  "version": "0.1.0",
  "description": "Quality audit, routing evaluation, source-graph consolidation, runtime linking, and schema governance workflows composed from independent primitives.",
  "skills": [
    {
      "type": "SKILL",
      "source": {
        "type": "LOCAL_SOURCE",
        "path": "./"
      },
      "path": "skills/primitive-quality-audit",
      "name": "primitive-quality-audit"
    },
    {
      "type": "SKILL",
      "source": {
        "type": "LOCAL_SOURCE",
        "path": "./"
      },
      "path": "skills/primitive-routing-evaluation",
      "name": "primitive-routing-evaluation"
    },
    {
      "type": "SKILL",
      "source": {
        "type": "LOCAL_SOURCE",
        "path": "./"
      },
      "path": "skills/source-graph-consolidation",
      "name": "source-graph-consolidation"
    },
    {
      "type": "SKILL",
      "source": {
        "type": "LOCAL_SOURCE",
        "path": "./"
      },
      "path": "skills/runtime-linking",
      "name": "runtime-linking"
    },
    {
      "type": "SKILL",
      "source": {
        "type": "LOCAL_SOURCE",
        "path": "./"
      },
      "path": "skills/manage-json-schemas",
      "name": "manage-json-schemas"
    }
  ],
  "agents": [
    {
      "type": "AGENT",
      "source": {
        "type": "LOCAL_SOURCE",
        "path": "./"
      },
      "path": "agents/schema-type-enforcer.agent.md",
      "name": "schema-type-enforcer"
    }
  ],
  "instructions": [
    {
      "type": "INSTRUCTION",
      "source": {
        "type": "LOCAL_SOURCE",
        "path": "./"
      },
      "path": "concepts/schema-driven-design/core.md",
      "name": "schema-driven-design"
    }
  ],
  "hooks": [],
  "metadata": {
    "composition": "referential",
    "auditManifest": "manifests/primitive-audits.json",
    "promotionManifest": "manifests/promotions.json",
    "runtimeLinks": "manifests/runtime-links.json",
    "cleanupLedger": "manifests/cleanup-ledger.json"
  }
}
