{
  "type": "PLUGIN",
  "schemaVersion": 1,
  "name": "git-ci-operations",
  "version": "0.1.0",
  "description": "Git and CI operations workflow for evidence-backed changes: goals, TDD, Git hygiene, PRs, GitHub Actions, releases, and shell-safe automation.",
  "skills": [
    {
      "type": "SKILL",
      "source": {
        "type": "LOCAL_SOURCE",
        "path": "./"
      },
      "path": "skills/define-goal",
      "name": "define-goal"
    },
    {
      "type": "SKILL",
      "source": {
        "type": "LOCAL_SOURCE",
        "path": "./"
      },
      "path": "skills/tdd",
      "name": "tdd"
    },
    {
      "type": "SKILL",
      "source": {
        "type": "LOCAL_SOURCE",
        "path": "./"
      },
      "path": "skills/git-change-flow",
      "name": "git-change-flow"
    },
    {
      "type": "SKILL",
      "source": {
        "type": "LOCAL_SOURCE",
        "path": "./"
      },
      "path": "skills/github-ci-operations",
      "name": "github-ci-operations"
    },
    {
      "type": "SKILL",
      "source": {
        "type": "LOCAL_SOURCE",
        "path": "./"
      },
      "path": "skills/shell-script-safety",
      "name": "shell-script-safety"
    },
    {
      "type": "SKILL",
      "source": {
        "type": "LOCAL_SOURCE",
        "path": "./"
      },
      "path": "skills/pull-request-lifecycle",
      "name": "pull-request-lifecycle"
    }
  ],
  "agents": [],
  "instructions": [
    {
      "type": "INSTRUCTION",
      "source": {
        "type": "LOCAL_SOURCE",
        "path": "./"
      },
      "path": "concepts/type-safety/core.md",
      "name": "type-safety"
    },
    {
      "type": "INSTRUCTION",
      "source": {
        "type": "LOCAL_SOURCE",
        "path": "./"
      },
      "path": "concepts/schema-driven-design/core.md",
      "name": "schema-driven-design"
    }
  ],
  "hooks": [],
  "metadata": {
    "composition": "referential",
    "dailyDriver": "Install in repositories where agents may branch, push, watch checks, merge, release, or repair CI with evidence.",
    "notFor": "Language-specific semantic review or canonical source-graph primitive authoring.",
    "owner": "git-ci-operations",
    "principle": "claims-require-executable-evidence",
    "role": "git-ci-operations",
    "scope": "Goal framing, TDD, local Git hygiene, PR lifecycle, GitHub Actions triage, release workflow repair, and shell-safe automation."
  }
}
