{
  "type": "PLUGIN",
  "schemaVersion": 1,
  "name": "runtime-activation",
  "version": "0.1.0",
  "description": "Runtime linking and source-graph activation workflows composed from independent primitives.",
  "skills": [
    {
      "type": "SKILL",
      "source": {
        "type": "LOCAL_SOURCE",
        "path": "./"
      },
      "path": "skills/runtime-linking",
      "name": "runtime-linking"
    },
    {
      "type": "SKILL",
      "source": {
        "type": "LOCAL_SOURCE",
        "path": "./"
      },
      "path": "skills/source-graph-consolidation",
      "name": "source-graph-consolidation"
    }
  ],
  "agents": [],
  "instructions": [
    {
      "type": "INSTRUCTION",
      "source": {
        "type": "LOCAL_SOURCE",
        "path": "./"
      },
      "path": "concepts/schema-driven-design/core.md",
      "name": "schema-driven-design"
    }
  ],
  "hooks": [],
  "metadata": {
    "composition": "referential",
    "runtimeLinks": "manifests/runtime-links.json",
    "promotionManifest": "manifests/promotions.json"
  }
}
